,id,bio,short_bio,coach_type,is_filterable,is_instructor_group,is_visible,is_announced,list_order,featured_profile,film_link,facebook_fan_page,music_bio,spotify_playlist_uri,background,ordered_q_and_as,instagram_profile,strava_profile,twitter_profile,quote,username,name,first_name,last_name,user_id,life_style_image_url,bike_instructor_list_display_image_url,web_instructor_list_display_image_url,ios_instructor_list_display_image_url,about_image_url,image_url,jumbotron_url,jumbotron_url_dark,jumbotron_url_ios,web_instructor_list_gif_image_url,instructor_hero_image_url,workout_share_images,fitness_disciplines
12,e2e6586d898d4422b3f6e3a259ff3f90,"Growing up in Hamburg, Cliff’s first love was football–until music came along. In fact, his love of hip hop saw him become the first German rapper to make it to the semi-finals of the ‘Voice of Germany’. Given he’s used to performing on a stage under the bright lights, it’s no wonder he feels so at home in the Peloton studio. As a Peloton Instructor, Cliff’s passion and energy mean you leave his class not only feeling like you’ve had a great workout, but also feeling re-energised and ready to hit all the high notes. Cliff rides in our London studio and does Bike and Bootcamp classes in German.
","As a Peloton Instructor, Cliff’s passion and energy help you leave his class not only feeling like you’ve had a great workout, but also being re-energised and ready to take on whatever life has in store for you. ",peloton_coach,True,False,True,True,29,True,,,,spotify:playlist:4OBXxsqS5D1npyRS6fyzZg,"I’m inspired by the synergy of music and fitness, it gives me an energy that I just have to pass on. Everyone feels that in every single class I give.","[['HOW DO YOU MOTIVATE?', 'As an athlete, praise and positive encouragement have always driven me to push myself beyond my limits and perform at my best. With this power, I want to motivate everyone to achieve more and look for fewer excuses. '], ['OUTSIDE OF PELOTON', ""When I'm not on the Peloton stage, I spend as much time as possible with my family. My wife and daughter mean everything to me.""], ['', '']]",,,,"No excuses - Don't look for excuses, find solutions.
",clifforddwenger,Cliff Dwenger,Cliff,Dwenger,47d9da6d7cbb469c90336c6e84d96e35,https://s3.amazonaws.com/workout-metric-images-prod/7d84ee1899864a8ebd6cc18a696177be,,https://s3.amazonaws.com/workout-metric-images-prod/c2dea99b3ee94b4d828fe99d8aaea45d,https://s3.amazonaws.com/workout-metric-images-prod/8b24a518bcb446deb1d40bf406b81518,https://s3.amazonaws.com/workout-metric-images-prod/2c96ee4d8e8e4ba6a494b8d269f97a65,https://s3.amazonaws.com/workout-metric-images-prod/caa1e6d98c3845c1835e44590504a658,,https://s3.amazonaws.com/workout-metric-images-prod/d6ced984b6e54df096312678112473bb,https://s3.amazonaws.com/workout-metric-images-prod/75378319d8f446a3b427babbecbd6d80,,https://s3.amazonaws.com/workout-metric-images-prod/e570b244090c445fbedde2a7a5f47ff2,"[{'fitness_discipline': 'bike_bootcamp', 'image_url': 'https://strava-default-images.s3-us-west-2.amazonaws.com/workout_share_image/default.png'}, {'fitness_discipline': 'caesar', 'image_url': 'https://strava-default-images.s3-us-west-2.amazonaws.com/workout_share_image/default.png'}, {'fitness_discipline': 'caesar_bootcamp', 'image_url': 'https://strava-default-images.s3-us-west-2.amazonaws.com/workout_share_image/default.png'}, {'fitness_discipline': 'cardio', 'image_url': 'https://strava-default-images.s3-us-west-2.amazonaws.com/workout_share_image/default.png'}, {'fitness_discipline': 'circuit', 'image_url': 'https://strava-default-images.s3-us-west-2.amazonaws.com/workout_share_image/default.png'}, {'fitness_discipline': 'cycling', 'image_url': 'https://s3.amazonaws.com/workout-metric-images-prod/218753bea1214a4dbf6b89fb421989e0'}, {'fitness_discipline': 'meditation', 'image_url': 'https://strava-default-images.s3-us-west-2.amazonaws.com/workout_share_image/default.png'}, {'fitness_discipline': 'running', 'image_url': 'https://strava-default-images.s3-us-west-2.amazonaws.com/workout_share_image/default.png'}, {'fitness_discipline': 'strength', 'image_url': 'https://strava-default-images.s3-us-west-2.amazonaws.com/workout_share_image/default.png'}, {'fitness_discipline': 'stretching', 'image_url': 'https://strava-default-images.s3-us-west-2.amazonaws.com/workout_share_image/default.png'}, {'fitness_discipline': 'walking', 'image_url': 'https://strava-default-images.s3-us-west-2.amazonaws.com/workout_share_image/default.png'}, {'fitness_discipline': 'yoga', 'image_url': 'https://strava-default-images.s3-us-west-2.amazonaws.com/workout_share_image/default.png'}]",['cycling']
13,f0b16be6d296405d901595f468520f69,"Marcel is an exceptional athlete with a background in basketball, track and field and cross country. Her time in the Army propelled her to unlock her true strength through structure and discipline. She uses this knowledge to empower her students of all levels—from the beginner to the experienced runner.

Marcel’s classes are exhilarating. Music powers her workouts, and trap and pop beats drive each interval. Marcel will motivate you as you run together to reach your next goal.",,peloton_coach,True,False,True,True,50,True,,,,spotify:playlist:5RS3uwuy7CkNJblYS8zdGr,I aim to empower and inspire in everything that I do. That’s my mission.,"[['How do you motivate? ', 'I live for a good challenge. I want Members to know that they don’t have to show up with all the answers but feel confident that together, as one unit, we will be relentless in ensuring they get across the finish line.'], ['Outside of Peloton?', 'I love movement. A bike ride through the borough, a hike upstate or even a walk through the park—I love being outdoors. I also love catching up with my closest friends and family to recharge and refill my cup.'], ['', '']]",,,,“Adversity introduces a man to himself.”,Peloton_M,Marcel Dinkins,Marcel,Dinkins,a56d10a81be44a93bf9d102ba75a1f12,https://s3.amazonaws.com/workout-metric-images-prod/d801415fb26d44b78a3d300776d1201c,,https://s3.amazonaws.com/workout-metric-images-prod/d9b8e9de399e4999a356f5d3674772fe,https://s3.amazonaws.com/workout-metric-images-prod/6e8573109f804a4a81316f579708bc9e,https://s3.amazonaws.com/workout-metric-images-prod/36c9616d1a084417bfb7d2c8dcdd8f7b,https://s3.amazonaws.com/workout-metric-images-prod/58547557d4e2489eb69573c10dc166d3,,https://s3.amazonaws.com/workout-metric-images-prod/1fcf165199024de0a102640e050d781f,https://s3.amazonaws.com/workout-metric-images-prod/520ef670b16340da91b5770c6565b68e,,https://s3.amazonaws.com/workout-metric-images-prod/018ffc0240494728a08bf715d2d6e3a4,"[{'fitness_discipline': 'bike_bootcamp', 'image_url': 'https://strava-default-images.s3-us-west-2.amazonaws.com/workout_share_image/default.png'}, {'fitness_discipline': 'caesar', 'image_url': 'https://strava-default-images.s3-us-west-2.amazonaws.com/workout_share_image/default.png'}, {'fitness_discipline': 'caesar_bootcamp', 'image_url': 'https://strava-default-images.s3-us-west-2.amazonaws.com/workout_share_image/default.png'}, {'fitness_discipline': 'cardio', 'image_url': 'https://strava-default-images.s3-us-west-2.amazonaws.com/workout_share_image/default.png'}, {'fitness_discipline': 'circuit', 'image_url': 'https://strava-default-images.s3-us-west-2.amazonaws.com/workout_share_image/default.png'}, {'fitness_discipline': 'cycling', 'image_url': 'https://strava-default-images.s3-us-west-2.amazonaws.com/workout_share_image/default.png'}, {'fitness_discipline': 'meditation', 'image_url': 'https://strava-default-images.s3-us-west-2.amazonaws.com/workout_share_image/default.png'}, {'fitness_discipline': 'running', 'image_url': 'https://strava-default-images.s3-us-west-2.amazonaws.com/workout_share_image/default.png'}, {'fitness_discipline': 'strength', 'image_url': 'https://strava-default-images.s3-us-west-2.amazonaws.com/workout_share_image/default.png'}, {'fitness_discipline': 'stretching', 'image_url': 'https://strava-default-images.s3-us-west-2.amazonaws.com/workout_share_image/default.png'}, {'fitness_discipline': 'walking', 'image_url': 'https://strava-default-images.s3-us-west-2.amazonaws.com/workout_share_image/default.png'}, {'fitness_discipline': 'yoga', 'image_url': 'https://strava-default-images.s3-us-west-2.amazonaws.com/workout_share_image/default.png'}]","['running', 'stretching', 'walking']"
14,f6f2d613dc344e4bbf6428cd34697820,"Emma Lovewell is a Martha’s Vineyard native and a woman of all trades. She’s spent much of her career in fitness and wellness as a professional dancer, dance coach, fitness model, personal trainer and pilates instructor. Emma was also a DJ, and brings this love of music to her teaching style at Peloton. She’s passionate about movement and connecting the heavy beats of her playlists to each ride she teaches. After class, expect to feel like you just stepped off the dance floor.","""I love you, but I’m going to push you.""",peloton_coach,True,False,True,True,32,True,,,Check out a sample of Emma’s current class playlist.,spotify:playlist:6mqUOujpwaekXulDV1RKNE,"I always try to find the perfect combination of training and entertainment so that class will fly by, and you won’t even realize how hard you just pushed yourself.","[['How Do You Motivate?', 'I want people to feel lighter when they finish my class; whether it’s leaving behind a puddle of sweat, or letting go of negative thoughts or feelings. Don’t ever miss an opportunity to get stronger.'], ['Outside of Peloton', 'I come from a creative family of entrepreneurs so I play the piano, enjoy painting watercolors, cooking, gardening, adventuring and traveling. I always need a creative outlet so I have a lot of hobbies!'], ['', '']]",,,,"I love you, but I’m going to push you.",islandlife17,Emma Lovewell,Emma,Lovewell,097db0ef549b4c27a29a68ba05856e22,https://s3.amazonaws.com/workout-metric-images-prod/3878062e2e724ec7be0d4c760d48b878,,https://s3.amazonaws.com/workout-metric-images-prod/7be8b722758d486f9f574fb953f82381,https://s3.amazonaws.com/workout-metric-images-prod/be2657d061244df09f6967b515fa4ce7,https://s3.amazonaws.com/workout-metric-images-prod/ee1ffd9057a74e2db11dc6817b0a0032,https://s3.amazonaws.com/workout-metric-images-prod/07cd6ac5d85e4ad5972c1a084c34a69e,,https://s3.amazonaws.com/workout-metric-images-prod/75d12342b4734750b8bb4b69348c3ac8,https://s3.amazonaws.com/workout-metric-images-prod/f0a26d656a054f4d8d6c6517cdf2dc98,,https://s3.amazonaws.com/workout-metric-images-prod/764c3e3354f14e0faeff8af79a811a32,"[{'fitness_discipline': 'bike_bootcamp', 'image_url': 'https://strava-default-images.s3-us-west-2.amazonaws.com/workout_share_image/default.png'}, {'fitness_discipline': 'caesar', 'image_url': 'https://strava-default-images.s3-us-west-2.amazonaws.com/workout_share_image/default.png'}, {'fitness_discipline': 'caesar_bootcamp', 'image_url': 'https://strava-default-images.s3-us-west-2.amazonaws.com/workout_share_image/default.png'}, {'fitness_discipline': 'cardio', 'image_url': 'https://strava-default-images.s3-us-west-2.amazonaws.com/workout_share_image/default.png'}, {'fitness_discipline': 'circuit', 'image_url': 'https://strava-default-images.s3-us-west-2.amazonaws.com/workout_share_image/default.png'}, {'fitness_discipline': 'cycling', 'image_url': 'https://s3.amazonaws.com/workout-metric-images-prod/d58e57b0662f4e009aef4d348d31f3ff'}, {'fitness_discipline': 'meditation', 'image_url': 'https://strava-default-images.s3-us-west-2.amazonaws.com/workout_share_image/default.png'}, {'fitness_discipline': 'running', 'image_url': 'https://strava-default-images.s3-us-west-2.amazonaws.com/workout_share_image/default.png'}, {'fitness_discipline': 'strength', 'image_url': 'https://strava-default-images.s3-us-west-2.amazonaws.com/workout_share_image/default.png'}, {'fitness_discipline': 'stretching', 'image_url': 'https://strava-default-images.s3-us-west-2.amazonaws.com/workout_share_image/default.png'}, {'fitness_discipline': 'walking', 'image_url': 'https://strava-default-images.s3-us-west-2.amazonaws.com/workout_share_image/default.png'}, {'fitness_discipline': 'yoga', 'image_url': 'https://strava-default-images.s3-us-west-2.amazonaws.com/workout_share_image/default.png'}]","['cycling', 'strength']"
