,id,bio,short_bio,coach_type,is_filterable,is_instructor_group,is_visible,is_announced,list_order,featured_profile,film_link,facebook_fan_page,music_bio,spotify_playlist_uri,background,ordered_q_and_as,instagram_profile,strava_profile,twitter_profile,quote,username,name,first_name,last_name,user_id,life_style_image_url,bike_instructor_list_display_image_url,web_instructor_list_display_image_url,ios_instructor_list_display_image_url,about_image_url,image_url,jumbotron_url,jumbotron_url_dark,jumbotron_url_ios,web_instructor_list_gif_image_url,instructor_hero_image_url,workout_share_images,fitness_disciplines
6,788569c2e088412799659a4f9ee334e2,"If there’s one thing Marcel cares about, it’s that you have fun during his classes and harness your inner power. The former soccer player has learned that giving back, supporting others and being present in the moment is much more powerful than any victory. In his classes, you can expect lots of motivation and positive vibes, as well as Marcel’s contagious smile.","Marcel wants you to have fun during your workout. The former soccer player firmly believes that giving back, supporting others and being present in the moment is much more powerful than any victory. Celebrate every workout with him.",peloton_coach,True,False,True,True,51,True,,,,spotify:playlist:6pU1lbIYWD2Kk5XU149vMP,"Soccer has been my passion ever since I can remember. I’ve taken all that fun, that spirit and the experiences of the game with me on my journey.","[['How Do You Motivate?', 'I want to help you find your inner power. But most importantly, I want you to have fun. Let’s celebrate every workout together!'], ['Outside of Peloton', 'I try to be present in every moment, and instead of my successes, I celebrate my experiences—walks with my girlfriend and our dog Hugo, travels or football games. My vice is ice cream. I have at least one every day.'], ['', '']]",,,,Let’s celebrate every workout together.,peloton_mm,Marcel Maurer,Marcel,Maurer,654e8f77703546c5a4ea2ee29eb0fd6c,https://s3.amazonaws.com/workout-metric-images-prod/83bc659efc8b47a7bc77459e7ff0f704,,https://s3.amazonaws.com/workout-metric-images-prod/1e37a408beb44b3e84c586001d39612b,https://s3.amazonaws.com/workout-metric-images-prod/3591d80ef3fd476b9eb537d8bed002fa,https://s3.amazonaws.com/workout-metric-images-prod/d8cf4efb11964968893251a7cd704b1b,https://s3.amazonaws.com/workout-metric-images-prod/a91ec58926b74942b435a55b41691ba9,,https://s3.amazonaws.com/workout-metric-images-prod/c349e48000c64a96a15be6dc225d53fe,https://s3.amazonaws.com/workout-metric-images-prod/ee72dd58a8fc4459b3e4005aec56dcdf,,https://s3.amazonaws.com/workout-metric-images-prod/89f85fa8490d4f2d84d4d215a85b86b6,"[{'fitness_discipline': 'bike_bootcamp', 'image_url': 'https://strava-default-images.s3-us-west-2.amazonaws.com/workout_share_image/default.png'}, {'fitness_discipline': 'caesar', 'image_url': 'https://strava-default-images.s3-us-west-2.amazonaws.com/workout_share_image/default.png'}, {'fitness_discipline': 'caesar_bootcamp', 'image_url': 'https://strava-default-images.s3-us-west-2.amazonaws.com/workout_share_image/default.png'}, {'fitness_discipline': 'cardio', 'image_url': 'https://strava-default-images.s3-us-west-2.amazonaws.com/workout_share_image/default.png'}, {'fitness_discipline': 'circuit', 'image_url': 'https://strava-default-images.s3-us-west-2.amazonaws.com/workout_share_image/default.png'}, {'fitness_discipline': 'cycling', 'image_url': 'https://strava-default-images.s3-us-west-2.amazonaws.com/workout_share_image/default.png'}, {'fitness_discipline': 'meditation', 'image_url': 'https://strava-default-images.s3-us-west-2.amazonaws.com/workout_share_image/default.png'}, {'fitness_discipline': 'running', 'image_url': 'https://strava-default-images.s3-us-west-2.amazonaws.com/workout_share_image/default.png'}, {'fitness_discipline': 'strength', 'image_url': 'https://strava-default-images.s3-us-west-2.amazonaws.com/workout_share_image/default.png'}, {'fitness_discipline': 'stretching', 'image_url': 'https://strava-default-images.s3-us-west-2.amazonaws.com/workout_share_image/default.png'}, {'fitness_discipline': 'walking', 'image_url': 'https://strava-default-images.s3-us-west-2.amazonaws.com/workout_share_image/default.png'}, {'fitness_discipline': 'yoga', 'image_url': 'https://strava-default-images.s3-us-west-2.amazonaws.com/workout_share_image/default.png'}]","['running', 'strength', 'walking']"
7,a8c56f162c964e9392568bc13828a3fb,"When Anna first turned to yoga, she felt a switch turn on inside of her. As she built a deeper connection with her mind and body, she began accomplishing things she never knew possible. Moved to share the transformative properties of the practice with others, Anna dove head first into yoga. Anna has crafted a unique teaching style that uses movement and music to help her Members connect to the same healing properties of yoga that she has experienced over the years. Anna is a prominent teacher trainer, workshop leader and instructor in NYC.",“Look for balance but always be willing to fall”,peloton_coach,True,False,True,True,17,True,,,,spotify:playlist:7G8bkXxki1aVYZSUFkuRNZ,"My classes combine heat building movement with precise, focused instruction for Members to find stability and space in their bodies and minds. Watching Members grow and thrive on the mat and in their lives is what inspires me to teach!","[['How Do You Motivate?', 'I aim to inspire people to do their best and let go of the results. Yoga is not a competition or performance, it’s just for you (how great is that?). It’s a tool to strengthen your relationship with yourself.'], ['Outside of Peloton', 'When I’m not standing on my hands, you can catch me traveling the world whenever, and wherever I can. I enjoy being in nature, hiking, biking and just walking around and taking it all in.'], ['', '']]",,,,Look for balance but always be willing to fall.,agreenberg,Anna Greenberg,Anna,Greenberg,026d817a66704ea6b5bc148ba0b803f7,https://s3.amazonaws.com/workout-metric-images-prod/b07a4ad3f0504d589f13d760ce010cd3,,https://s3.amazonaws.com/workout-metric-images-prod/a423930b36cc4794b1d1ea836f33768c,https://s3.amazonaws.com/workout-metric-images-prod/3c7b43033049475b9b3b95d67848c683,https://s3.amazonaws.com/workout-metric-images-prod/76f3fbaa9c6448579f7d0d9bed8a5b53,https://s3.amazonaws.com/workout-metric-images-prod/129eb1916178457fac5a39476a1211ce,,https://s3.amazonaws.com/workout-metric-images-prod/6081ded723014f1c9e89841efac9dfd7,https://s3.amazonaws.com/workout-metric-images-prod/028db643b6d0412f898afe791a0d9d34,,https://s3.amazonaws.com/workout-metric-images-prod/7e14b96b609f4e47b497ef9b844a5b98,"[{'fitness_discipline': 'bike_bootcamp', 'image_url': 'https://strava-default-images.s3-us-west-2.amazonaws.com/workout_share_image/default.png'}, {'fitness_discipline': 'caesar', 'image_url': 'https://strava-default-images.s3-us-west-2.amazonaws.com/workout_share_image/default.png'}, {'fitness_discipline': 'caesar_bootcamp', 'image_url': 'https://strava-default-images.s3-us-west-2.amazonaws.com/workout_share_image/default.png'}, {'fitness_discipline': 'cardio', 'image_url': 'https://strava-default-images.s3-us-west-2.amazonaws.com/workout_share_image/default.png'}, {'fitness_discipline': 'circuit', 'image_url': 'https://strava-default-images.s3-us-west-2.amazonaws.com/workout_share_image/default.png'}, {'fitness_discipline': 'cycling', 'image_url': 'https://strava-default-images.s3-us-west-2.amazonaws.com/workout_share_image/default.png'}, {'fitness_discipline': 'meditation', 'image_url': 'https://s3.amazonaws.com/workout-metric-images-prod/998be6435781467d875b2b91cc61cc2e'}, {'fitness_discipline': 'running', 'image_url': 'https://strava-default-images.s3-us-west-2.amazonaws.com/workout_share_image/default.png'}, {'fitness_discipline': 'strength', 'image_url': 'https://strava-default-images.s3-us-west-2.amazonaws.com/workout_share_image/default.png'}, {'fitness_discipline': 'stretching', 'image_url': 'https://strava-default-images.s3-us-west-2.amazonaws.com/workout_share_image/default.png'}, {'fitness_discipline': 'walking', 'image_url': 'https://strava-default-images.s3-us-west-2.amazonaws.com/workout_share_image/default.png'}, {'fitness_discipline': 'yoga', 'image_url': 'https://s3.amazonaws.com/workout-metric-images-prod/b83eaf960189443cb6822e894abb8f52'}]","['meditation', 'yoga']"
8,c406f36aa2a44a5baf8831f8b92f6920,"Peloton’s VP of Fitness Programming, Robin believes that sweat transforms lives. Her journey to Peloton came after she literally ran herself out of a successful law career. Robin is passionate about guiding Members past their limitations and excuses with inspiring, authentic anecdotes. Author of the New York Times bestseller Shut Up and Run, Robin is a RRCA-certified running coach and ultramarathoner. Her life’s mission is to redefine and rethink possibility through movement.","""We don’t do basic.""",peloton_coach,True,False,True,True,61,True,,https://www.facebook.com/robin.arzon/,Ready to ride? Check out a sample of Robin's current class playlist.,spotify:playlist:4sYCEETzj7tdh5mWLz7Owv,"A life lived in sweat is my mission. Every day, I work hard planting seeds for tomorrow’s greatness. The hustle in me honors the hustle in you.","[['How Do You Motivate?', 'With a heavy dose of tough love because iron sharpens iron. The pride of hard work lasts longer than the discomfort. And no matter what, just keep showing up.'], ['Outside of Peloton', ' Always searching for the next best sweat, you can catch me adding up miles and increasing reps around New York City and beyond.'], ['', '']]",,,,"We don’t do basic.
",robin,Robin Arzón,Robin,Arzón,102b025fb7b8451b8cc07d7d88e87377,https://s3.amazonaws.com/workout-metric-images-prod/1cf71afa881f4050ba2b0445a6e0c95b,,https://s3.amazonaws.com/workout-metric-images-prod/5f76d2bb1fd64483b45569013b8ff97b,https://s3.amazonaws.com/workout-metric-images-prod/34755616977f418a96b04bd1cd21af7f,https://s3.amazonaws.com/workout-metric-images-prod/e68c110d62f6401db2ae101eeed250db,https://s3.amazonaws.com/workout-metric-images-prod/4f14e005ca914ab68b313c3f752b3574,,https://s3.amazonaws.com/workout-metric-images-prod/01b64cfe1e204236bdfc08a09f25346b,https://s3.amazonaws.com/workout-metric-images-prod/f0a54562dda34bb695cccb2260a1638c,,https://s3.amazonaws.com/workout-metric-images-prod/2d79af1b272e4508bc8c746098d05226,"[{'fitness_discipline': 'bike_bootcamp', 'image_url': 'https://s3.amazonaws.com/workout-metric-images-prod/9a9fb6f6d9034dfcb73a7e3c8eb1f474'}, {'fitness_discipline': 'caesar', 'image_url': 'https://strava-default-images.s3-us-west-2.amazonaws.com/workout_share_image/default.png'}, {'fitness_discipline': 'caesar_bootcamp', 'image_url': 'https://strava-default-images.s3-us-west-2.amazonaws.com/workout_share_image/default.png'}, {'fitness_discipline': 'cardio', 'image_url': 'https://s3.amazonaws.com/workout-metric-images-prod/9a9fb6f6d9034dfcb73a7e3c8eb1f474'}, {'fitness_discipline': 'circuit', 'image_url': 'https://s3.amazonaws.com/workout-metric-images-prod/874f859d48b94f2cb6efd85c3522ef81'}, {'fitness_discipline': 'cycling', 'image_url': 'https://s3.amazonaws.com/workout-metric-images-prod/664693ca12f148c0be1ff1fdd0240808'}, {'fitness_discipline': 'meditation', 'image_url': 'https://strava-default-images.s3-us-west-2.amazonaws.com/workout_share_image/default.png'}, {'fitness_discipline': 'running', 'image_url': 'https://s3.amazonaws.com/workout-metric-images-prod/874f859d48b94f2cb6efd85c3522ef81'}, {'fitness_discipline': 'strength', 'image_url': 'https://s3.amazonaws.com/workout-metric-images-prod/9a9fb6f6d9034dfcb73a7e3c8eb1f474'}, {'fitness_discipline': 'stretching', 'image_url': 'https://s3.amazonaws.com/workout-metric-images-prod/4e76a1003b7b4ce2958e622698b0151e'}, {'fitness_discipline': 'walking', 'image_url': 'https://s3.amazonaws.com/workout-metric-images-prod/338e633d4c1448fc8d444d8cecda81c3'}, {'fitness_discipline': 'yoga', 'image_url': 'https://strava-default-images.s3-us-west-2.amazonaws.com/workout_share_image/default.png'}]","['bike_bootcamp', 'cycling', 'running', 'strength', 'stretching', 'walking']"
9,c8f95daedc2c4291a12008153a977661,"Kirsten welcomes runners of all levels in her motivating classes. A successful career woman turned fitness instructor, Kirsten wholeheartedly embraces the changes that life brings. After seven years of working with the NFL, she shifted her focus to family. Her journey to motherhood was not easy, and fitness helped Kirsten strengthen her body and soul during difficult times. She is now the proud mother of two beautiful daughters and uses her life experiences to fuel her deeply inspiring workouts. Get lifted with Kirsten as you run together to the beats of her favorite hip hop and R&B tracks.",,peloton_coach,True,False,True,True,46,True,,,,spotify:playlist:37hqeFDzZr6b9T0UCaviHB,"My goal in every class is to remind you that you are more than enough. If it is on your heart to do it, that means you have already been called to it. You just have to take that step, and I’ll be here right alongside you.","[['How do you motivate? ', 'Come as you! I coach from a place of learning from past experiences. We get comfortable in the uncomfortable. Let go of the idea of perfection and embrace your uniqueness.That is your superpower! You are a warrior. '], ['Outside of Peloton?', 'You can find me being a silly mom with my two daughters. Currently, singing and dance parties are our thing. When the babies are asleep, I’m at the gym or listening to the most ratchet music I can find.'], ['', '']]",,,,"“Don’t let anyone dim your light. You were born to shine, baby!”",Peloton_KF,Kirsten Ferguson,Kirsten,Ferguson,31ae007e7a7240c7828064205437909f,https://s3.amazonaws.com/workout-metric-images-prod/cbb609d70d7e4a1ab8662023cbdc3663,,https://s3.amazonaws.com/workout-metric-images-prod/417dd2719775473c836b8ea7fa1b6137,https://s3.amazonaws.com/workout-metric-images-prod/440298c40ec941e586e805b9f3b468d1,https://s3.amazonaws.com/workout-metric-images-prod/91dbd3a3aa684ce298155a22d3290509,https://s3.amazonaws.com/workout-metric-images-prod/aa3ddcca8dfd4743b771d1c036d30aec,,https://s3.amazonaws.com/workout-metric-images-prod/fe89679e9234488fb750eb1b1a120b13,https://s3.amazonaws.com/workout-metric-images-prod/a3b9543053814a8ea548174b0225fc8d,,https://s3.amazonaws.com/workout-metric-images-prod/fb8b57f5dfbb417f97b446dff4d0915a,"[{'fitness_discipline': 'bike_bootcamp', 'image_url': 'https://strava-default-images.s3-us-west-2.amazonaws.com/workout_share_image/default.png'}, {'fitness_discipline': 'caesar', 'image_url': 'https://strava-default-images.s3-us-west-2.amazonaws.com/workout_share_image/default.png'}, {'fitness_discipline': 'caesar_bootcamp', 'image_url': 'https://strava-default-images.s3-us-west-2.amazonaws.com/workout_share_image/default.png'}, {'fitness_discipline': 'cardio', 'image_url': 'https://strava-default-images.s3-us-west-2.amazonaws.com/workout_share_image/default.png'}, {'fitness_discipline': 'circuit', 'image_url': 'https://strava-default-images.s3-us-west-2.amazonaws.com/workout_share_image/default.png'}, {'fitness_discipline': 'cycling', 'image_url': 'https://strava-default-images.s3-us-west-2.amazonaws.com/workout_share_image/default.png'}, {'fitness_discipline': 'meditation', 'image_url': 'https://strava-default-images.s3-us-west-2.amazonaws.com/workout_share_image/default.png'}, {'fitness_discipline': 'running', 'image_url': 'https://strava-default-images.s3-us-west-2.amazonaws.com/workout_share_image/default.png'}, {'fitness_discipline': 'strength', 'image_url': 'https://strava-default-images.s3-us-west-2.amazonaws.com/workout_share_image/default.png'}, {'fitness_discipline': 'stretching', 'image_url': 'https://strava-default-images.s3-us-west-2.amazonaws.com/workout_share_image/default.png'}, {'fitness_discipline': 'walking', 'image_url': 'https://strava-default-images.s3-us-west-2.amazonaws.com/workout_share_image/default.png'}, {'fitness_discipline': 'yoga', 'image_url': 'https://strava-default-images.s3-us-west-2.amazonaws.com/workout_share_image/default.png'}]","['running', 'stretching', 'walking']"
10,c9bd86e59b9b4f96981848467838aa9c,"Tunde’s mission is to inspire and motivate other people to believe in the impossible. After years of struggling with her weight and self-confidence, Tunde fell in love with fitness and the doors it opened for her. Through a career as a celebrity makeup artist and brand educator, she discovered that she had a knack for teaching others to feel empowered and strong. Tunde brings an unparalleled positive energy to the Bike, fueled by personal experiences, perseverance and powerful playlists. There’s no doubt you’ll leave her classes feeling on top of the world. ","Tunde’s mission is to inspire and motivate other people to believe in the impossible. After overcoming challenging life experiences, Tunde radiates positivity and perseverance from the inside out.",peloton_coach,True,False,True,True,67,True,,,,spotify:playlist:4eJ2m3xUHt5w5shs78u3pM,"I focus on crafting my classes with music that drives you. This rush of adrenaline allows you to move past the expectations or limitations you showed up with that day. Beyond that, I will always push you, but never let you fall. ","[['How Do You Motivate?', ""I motivate from experience. I'm on a forever journey, and have been in your shoes before. I will always push you, because I know you can come up from where you are, even if you haven’t fully realized it yet. ""], ['Outside of Peloton', 'I’m from Texas, so Tex-Mex and margaritas have a special place in my heart. The beach is my happy place, laughing is my favorite thing to do and I’ll never turn down the chance to strut across a dance floor! '], ['', '']]",,,,Embrace the beauty of uncertainty. It’s a place of infinite possibility.,nyhustle,Tunde Oyeneyin,Tunde,Oyeneyin,326a4fda216b45c6b028cb97c552496f,https://s3.amazonaws.com/workout-metric-images-prod/7b50a2a4993049ab849cc5e292584ba7,,https://s3.amazonaws.com/workout-metric-images-prod/5d4d71df2b2047f69d5a8668deac866e,https://s3.amazonaws.com/workout-metric-images-prod/bb424254865a407c90d9745941d69e3c,https://s3.amazonaws.com/workout-metric-images-prod/7bfd81e972a84eb684194f5f427d616c,https://s3.amazonaws.com/workout-metric-images-prod/d13ced311d4347598a7009edd6197649,,https://s3.amazonaws.com/workout-metric-images-prod/d83389176d7f441bbc39c6b69006ca1a,https://s3.amazonaws.com/workout-metric-images-prod/f5bd0b31c8944f849fb4e19b0ae6a507,,https://s3.amazonaws.com/workout-metric-images-prod/f53e9d29c09f4b60a99fd5f258df4075,"[{'fitness_discipline': 'bike_bootcamp', 'image_url': 'https://s3.amazonaws.com/workout-metric-images-prod/b34acf1ec60946e488e299f69555e6ef'}, {'fitness_discipline': 'caesar', 'image_url': 'https://strava-default-images.s3-us-west-2.amazonaws.com/workout_share_image/default.png'}, {'fitness_discipline': 'caesar_bootcamp', 'image_url': 'https://strava-default-images.s3-us-west-2.amazonaws.com/workout_share_image/default.png'}, {'fitness_discipline': 'cardio', 'image_url': 'https://strava-default-images.s3-us-west-2.amazonaws.com/workout_share_image/default.png'}, {'fitness_discipline': 'circuit', 'image_url': 'https://strava-default-images.s3-us-west-2.amazonaws.com/workout_share_image/default.png'}, {'fitness_discipline': 'cycling', 'image_url': 'https://s3.amazonaws.com/workout-metric-images-prod/dbd09c01bc684c33b001b96efff361e1'}, {'fitness_discipline': 'meditation', 'image_url': 'https://strava-default-images.s3-us-west-2.amazonaws.com/workout_share_image/default.png'}, {'fitness_discipline': 'running', 'image_url': 'https://strava-default-images.s3-us-west-2.amazonaws.com/workout_share_image/default.png'}, {'fitness_discipline': 'strength', 'image_url': 'https://s3.amazonaws.com/workout-metric-images-prod/b34acf1ec60946e488e299f69555e6ef'}, {'fitness_discipline': 'stretching', 'image_url': 'https://strava-default-images.s3-us-west-2.amazonaws.com/workout_share_image/default.png'}, {'fitness_discipline': 'walking', 'image_url': 'https://strava-default-images.s3-us-west-2.amazonaws.com/workout_share_image/default.png'}, {'fitness_discipline': 'yoga', 'image_url': 'https://strava-default-images.s3-us-west-2.amazonaws.com/workout_share_image/default.png'}]","['bike_bootcamp', 'cycling', 'strength', 'stretching']"
11,c9fa21c2004c4544a7c35c28a6196c77,"Andy takes a technique-centered approach to fitness, drawing on his experience as an accomplished former gymnast and pole vaulter in his home state of Connecticut. A celebrated personal trainer in NYC before joining Peloton, Andy is inspired by the world-class fitness and strength coaches who taught him, and brings his breadth of training knowledge to every workout.","""Fight Fatigue with Focus.""",peloton_coach,True,False,True,True,16,True,,https://www.facebook.com/AndySpeerPeloton/,,spotify:playlist:5A0oz7QUqSTV7JIAWKiLeM,"My inspiration for teaching is rooted in helping others improve their lives through fitness, as other coaches have done for me, now it’s my turn to pay it forward.","[['How Do You Motivate?', 'I want members to approach my class with an intent to be challenged and grow. I focus on technique and ensure that there is a purpose behind everything I ask of you.'], ['Outside of Peloton', 'My training also includes gymnastics, kettlebells, Olympic weightlifting, Muay Thai kickboxing, and yoga. I also enjoy watching documentaries, meditation, reading, and listening to Podcasts.'], ['', '']]",,,,Fight Fatigue with Focus.,ASpeer,Andy Speer,Andy,Speer,1983bc74b89c403db8876500b1895573,https://s3.amazonaws.com/workout-metric-images-prod/8411c574a4104025ab2916d8ee54edab,,https://s3.amazonaws.com/workout-metric-images-prod/a3a346200ad74a70a7c5b9befdec0ca7,https://s3.amazonaws.com/workout-metric-images-prod/eaabe8c22f604b54aea5302f7ad28be7,https://s3.amazonaws.com/workout-metric-images-prod/4a54f450fb044bdeabb8b477ec9d9d5c,https://s3.amazonaws.com/workout-metric-images-prod/f2141244bb4048958bc74f2a45393333,,https://s3.amazonaws.com/workout-metric-images-prod/bdc979610ef744d59b638e0755d39e6e,https://s3.amazonaws.com/workout-metric-images-prod/4b8f1b159b514174987482648104ece7,,https://s3.amazonaws.com/workout-metric-images-prod/730914f14b8c43d5b26e916beeffbbeb,"[{'fitness_discipline': 'bike_bootcamp', 'image_url': 'https://strava-default-images.s3-us-west-2.amazonaws.com/workout_share_image/default.png'}, {'fitness_discipline': 'caesar', 'image_url': 'https://strava-default-images.s3-us-west-2.amazonaws.com/workout_share_image/default.png'}, {'fitness_discipline': 'caesar_bootcamp', 'image_url': 'https://strava-default-images.s3-us-west-2.amazonaws.com/workout_share_image/default.png'}, {'fitness_discipline': 'cardio', 'image_url': 'https://s3.amazonaws.com/workout-metric-images-prod/ee64fd9af8e04d08a5f3b74ec6480098'}, {'fitness_discipline': 'circuit', 'image_url': 'https://s3.amazonaws.com/workout-metric-images-prod/45794c9b8f13472f82d4cdff4367529b'}, {'fitness_discipline': 'cycling', 'image_url': 'https://strava-default-images.s3-us-west-2.amazonaws.com/workout_share_image/default.png'}, {'fitness_discipline': 'meditation', 'image_url': 'https://strava-default-images.s3-us-west-2.amazonaws.com/workout_share_image/default.png'}, {'fitness_discipline': 'running', 'image_url': 'https://s3.amazonaws.com/workout-metric-images-prod/45794c9b8f13472f82d4cdff4367529b'}, {'fitness_discipline': 'strength', 'image_url': 'https://s3.amazonaws.com/workout-metric-images-prod/ee64fd9af8e04d08a5f3b74ec6480098'}, {'fitness_discipline': 'stretching', 'image_url': 'https://s3.amazonaws.com/workout-metric-images-prod/ee64fd9af8e04d08a5f3b74ec6480098'}, {'fitness_discipline': 'walking', 'image_url': 'https://s3.amazonaws.com/workout-metric-images-prod/45794c9b8f13472f82d4cdff4367529b'}, {'fitness_discipline': 'yoga', 'image_url': 'https://strava-default-images.s3-us-west-2.amazonaws.com/workout_share_image/default.png'}]","['cardio', 'circuit', 'running', 'strength', 'stretching', 'walking']"
